[
  {
    "caseId": "CASE-01",
    "difficultyLevel": 2,
    "family": "independent_corroboration",
    "events": [
      {
        "trueEventId": "EVT-CASE-01-A",
        "hazardType": "landslide",
        "geometry": {
          "type": "Point",
          "coordinates": [
            77.3031,
            31.602
          ]
        },
        "eventStart": "2026-08-15T08:00:00Z",
        "eventEnd": "2026-08-15T18:00:00Z",
        "trueEventState": "active",
        "evidenceIds": [
          "EVID-0001",
          "EVID-0002",
          "EVID-0003",
          "EVID-0004",
          "EVID-0005",
          "EVID-0006",
          "EVID-0007",
          "EVID-0008",
          "EVID-0009",
          "EVID-0010",
          "EVID-0011"
        ],
        "independentLineageIds": [
          "L1",
          "L2",
          "L3",
          "L4",
          "L5",
          "L6",
          "L7",
          "L8",
          "L9",
          "L10",
          "L11"
        ],
        "conflictingEvidenceIds": []
      }
    ]
  },
  {
    "caseId": "CASE-02",
    "difficultyLevel": 3,
    "family": "independent_corroboration",
    "events": [
      {
        "trueEventId": "EVT-CASE-02-A",
        "hazardType": "landslide",
        "geometry": {
          "type": "Point",
          "coordinates": [
            77.353,
            32.2313
          ]
        },
        "eventStart": "2026-08-15T08:00:00Z",
        "eventEnd": "2026-08-15T18:00:00Z",
        "trueEventState": "active",
        "evidenceIds": [
          "EVID-0012",
          "EVID-0013",
          "EVID-0014",
          "EVID-0015",
          "EVID-0016",
          "EVID-0017",
          "EVID-0018",
          "EVID-0019",
          "EVID-0020",
          "EVID-0021",
          "EVID-0022",
          "EVID-0023"
        ],
        "independentLineageIds": [
          "L1",
          "L2",
          "L3",
          "L4",
          "L5",
          "L6",
          "L7",
          "L8",
          "L9",
          "L10",
          "L11",
          "L12"
        ],
        "conflictingEvidenceIds": []
      }
    ]
  },
  {
    "caseId": "CASE-03",
    "difficultyLevel": 1,
    "family": "independent_corroboration",
    "events": [
      {
        "trueEventId": "EVT-CASE-03-A",
        "hazardType": "landslide",
        "geometry": {
          "type": "Point",
          "coordinates": [
            78.4679,
            32.4301
          ]
        },
        "eventStart": "2026-08-15T08:00:00Z",
        "eventEnd": "2026-08-15T18:00:00Z",
        "trueEventState": "active",
        "evidenceIds": [
          "EVID-0024",
          "EVID-0025",
          "EVID-0026",
          "EVID-0027",
          "EVID-0028",
          "EVID-0029",
          "EVID-0030",
          "EVID-0031",
          "EVID-0032",
          "EVID-0033",
          "EVID-0034",
          "EVID-0035",
          "EVID-0036"
        ],
        "independentLineageIds": [
          "L1",
          "L2",
          "L3",
          "L4",
          "L5",
          "L6",
          "L7",
          "L8",
          "L9",
          "L10",
          "L11",
          "L12",
          "L13"
        ],
        "conflictingEvidenceIds": []
      }
    ]
  },
  {
    "caseId": "CASE-04",
    "difficultyLevel": 2,
    "family": "independent_corroboration",
    "events": [
      {
        "trueEventId": "EVT-CASE-04-A",
        "hazardType": "landslide",
        "geometry": {
          "type": "Point",
          "coordinates": [
            77.1567,
            32.2818
          ]
        },
        "eventStart": "2026-08-15T08:00:00Z",
        "eventEnd": "2026-08-15T18:00:00Z",
        "trueEventState": "active",
        "evidenceIds": [
          "EVID-0037",
          "EVID-0038",
          "EVID-0039",
          "EVID-0040",
          "EVID-0041",
          "EVID-0042",
          "EVID-0043",
          "EVID-0044",
          "EVID-0045",
          "EVID-0046"
        ],
        "independentLineageIds": [
          "L1",
          "L2",
          "L3",
          "L4",
          "L5",
          "L6",
          "L7",
          "L8",
          "L9",
          "L10"
        ],
        "conflictingEvidenceIds": []
      }
    ]
  },
  {
    "caseId": "CASE-05",
    "difficultyLevel": 3,
    "family": "independent_corroboration",
    "events": [
      {
        "trueEventId": "EVT-CASE-05-A",
        "hazardType": "landslide",
        "geometry": {
          "type": "Point",
          "coordinates": [
            77.5155,
            31.7848
          ]
        },
        "eventStart": "2026-08-15T08:00:00Z",
        "eventEnd": "2026-08-15T18:00:00Z",
        "trueEventState": "active",
        "evidenceIds": [
          "EVID-0047",
          "EVID-0048",
          "EVID-0049",
          "EVID-0050",
          "EVID-0051",
          "EVID-0052",
          "EVID-0053",
          "EVID-0054",
          "EVID-0055",
          "EVID-0056",
          "EVID-0057"
        ],
        "independentLineageIds": [
          "L1",
          "L2",
          "L3",
          "L4",
          "L5",
          "L6",
          "L7",
          "L8",
          "L9",
          "L10",
          "L11"
        ],
        "conflictingEvidenceIds": []
      }
    ]
  },
  {
    "caseId": "CASE-06",
    "difficultyLevel": 1,
    "family": "independent_corroboration",
    "events": [
      {
        "trueEventId": "EVT-CASE-06-A",
        "hazardType": "landslide",
        "geometry": {
          "type": "Point",
          "coordinates": [
            77.0545,
            32.1308
          ]
        },
        "eventStart": "2026-08-15T08:00:00Z",
        "eventEnd": "2026-08-15T18:00:00Z",
        "trueEventState": "active",
        "evidenceIds": [
          "EVID-0058",
          "EVID-0059",
          "EVID-0060",
          "EVID-0061",
          "EVID-0062",
          "EVID-0063",
          "EVID-0064",
          "EVID-0065",
          "EVID-0066",
          "EVID-0067",
          "EVID-0068",
          "EVID-0069"
        ],
        "independentLineageIds": [
          "L1",
          "L2",
          "L3",
          "L4",
          "L5",
          "L6",
          "L7",
          "L8",
          "L9",
          "L10",
          "L11",
          "L12"
        ],
        "conflictingEvidenceIds": []
      }
    ]
  },
  {
    "caseId": "CASE-07",
    "difficultyLevel": 2,
    "family": "repost_echo_amplification",
    "events": [
      {
        "trueEventId": "EVT-CASE-07-A",
        "hazardType": "landslide",
        "geometry": {
          "type": "Point",
          "coordinates": [
            78.031,
            31.4889
          ]
        },
        "eventStart": "2026-08-15T08:00:00Z",
        "eventEnd": "2026-08-15T18:00:00Z",
        "trueEventState": "active",
        "evidenceIds": [
          "EVID-0070",
          "EVID-0071",
          "EVID-0072",
          "EVID-0073",
          "EVID-0074",
          "EVID-0075",
          "EVID-0076",
          "EVID-0077",
          "EVID-0078",
          "EVID-0079",
          "EVID-0080",
          "EVID-0081",
          "EVID-0082",
          "EVID-0083"
        ],
        "independentLineageIds": [
          "L1"
        ],
        "conflictingEvidenceIds": []
      }
    ]
  },
  {
    "caseId": "CASE-08",
    "difficultyLevel": 3,
    "family": "repost_echo_amplification",
    "events": [
      {
        "trueEventId": "EVT-CASE-08-A",
        "hazardType": "landslide",
        "geometry": {
          "type": "Point",
          "coordinates": [
            78.1465,
            31.8846
          ]
        },
        "eventStart": "2026-08-15T08:00:00Z",
        "eventEnd": "2026-08-15T18:00:00Z",
        "trueEventState": "active",
        "evidenceIds": [
          "EVID-0084",
          "EVID-0085",
          "EVID-0086",
          "EVID-0087",
          "EVID-0088",
          "EVID-0089",
          "EVID-0090",
          "EVID-0091",
          "EVID-0092",
          "EVID-0093",
          "EVID-0094",
          "EVID-0095",
          "EVID-0096",
          "EVID-0097",
          "EVID-0098"
        ],
        "independentLineageIds": [
          "L1"
        ],
        "conflictingEvidenceIds": []
      }
    ]
  },
  {
    "caseId": "CASE-09",
    "difficultyLevel": 1,
    "family": "repost_echo_amplification",
    "events": [
      {
        "trueEventId": "EVT-CASE-09-A",
        "hazardType": "landslide",
        "geometry": {
          "type": "Point",
          "coordinates": [
            78.3755,
            32.0638
          ]
        },
        "eventStart": "2026-08-15T08:00:00Z",
        "eventEnd": "2026-08-15T18:00:00Z",
        "trueEventState": "active",
        "evidenceIds": [
          "EVID-0099",
          "EVID-0100",
          "EVID-0101",
          "EVID-0102",
          "EVID-0103",
          "EVID-0104",
          "EVID-0105",
          "EVID-0106",
          "EVID-0107",
          "EVID-0108",
          "EVID-0109",
          "EVID-0110",
          "EVID-0111",
          "EVID-0112",
          "EVID-0113",
          "EVID-0114"
        ],
        "independentLineageIds": [
          "L1"
        ],
        "conflictingEvidenceIds": []
      }
    ]
  },
  {
    "caseId": "CASE-10",
    "difficultyLevel": 2,
    "family": "repost_echo_amplification",
    "events": [
      {
        "trueEventId": "EVT-CASE-10-A",
        "hazardType": "landslide",
        "geometry": {
          "type": "Point",
          "coordinates": [
            77.292,
            32.0986
          ]
        },
        "eventStart": "2026-08-15T08:00:00Z",
        "eventEnd": "2026-08-15T18:00:00Z",
        "trueEventState": "active",
        "evidenceIds": [
          "EVID-0115",
          "EVID-0116",
          "EVID-0117",
          "EVID-0118",
          "EVID-0119",
          "EVID-0120",
          "EVID-0121",
          "EVID-0122",
          "EVID-0123",
          "EVID-0124",
          "EVID-0125",
          "EVID-0126"
        ],
        "independentLineageIds": [